{
  "contract": "ctx.todo-handle.v1",
  "status": "dispatched",
  "task_item_id": "11111111-1111-4111-8111-111111111111",
  "graph_created": true,
  "graph_repaired": false,
  "graph": { "revision": 1, "shape_hash": "aaaaaaaaaaaaaaaaaaaaaaaaaaaaaaaaaaaaaaaaaaaaaaaaaaaaaaaaaaaaaaaa", "state": "active", "satisfied_count": 0, "required_count": 1 },
  "node_item_id": "22222222-2222-4222-8222-222222222222",
  "job_id": "33333333-3333-4333-8333-333333333333",
  "receipt_id": null,
  "jobs": [{
    "receipt_id": null, "job_id": "33333333-3333-4333-8333-333333333333", "node_item_id": "22222222-2222-4222-8222-222222222222",
    "executor": "orb", "state": "queued", "replayed": false, "repo": "zackproser/ctx"
  }],
  "replayed": false,
  "reason": "Dispatched one lane.",
  "work_url": "/app?stage=work",
  "fleet_url": null
}
